job_link,job_skills
https://demo.jmi/j/001,"python, sql, machine learning, pandas, scikit-learn"
https://demo.jmi/j/002,"python, r, statistics, tensorflow, sql"
https://demo.jmi/j/003,"python, pytorch, docker, kubernetes, mlops"
https://demo.jmi/j/004,"java, spring boot, sql, redis, kafka"
https://demo.jmi/j/005,"go, postgresql, grpc, aws, docker"
https://demo.jmi/j/006,"javascript, react, typescript, html, css"
https://demo.jmi/j/007,"javascript, node.js, react, sql, mongodb"
https://demo.jmi/j/008,"docker, kubernetes, terraform, aws, linux"
